{
  "bat": {
    "v": 2754,
    "ts": "2019-07-24T11:45:47.123Z"
  },
  "acc": {
    "v": [0.2, 0.777, -4.7],
    "ts": "2019-07-24T11:45:43.666Z"
  },
  "gps": {
    "v": {
      "lng": 10.436642,
      "lat": 63.421133,
      "acc": 24.798573,
      "alt": 170.528305,
      "spd": 0.579327,
      "hdg": 176.12
    },
    "ts": "2019-07-24T11:45:52.991Z"
  },
  "cfg": {
    "gpst": 720,
    "act": false,
    "actwt": 60,
    "mvres": 60,
    "mvt": 3600,
    "acct": 12
  }
}
